{"$schema":"./challenger-replacement-deployment-v1.schema.json","authority":{"production_activation":false,"real_orders_allowed":false,"replacement_start_authorized":false,"runtime_install_authorized":false},"candidate_release":{"manifest_version":"1.61.0","package_version":"0.67.0","release_tag":"v0.67.0"},"deployment_hash":"d6701fe1b1a62bfaed106492b0b54f1af1dbf04606b1f9ce103d7e53b6a9cc9f","deployment_id":"challenger_replacement_deployment_f64793770201000bf214b1080730df00745fa4b738aed04adcedbf8807a2e181","foundation":{"build_input_tree_hash":"f22df35dd1a2c9dbf0885406fa5f8f7f6167efde1ac9a4e71049bc2c01ea86ae","main_ci_jobs":{"Python 3.12":"success","Python 3.9":"success","macOS 15 arm64":"success"},"main_ci_run":32554406969,"manifest_file_sha256":"bff44edf8dd6025ad4683293380458d08e85e9b0f47377844dc5a86614e48ed6","manifest_hash":"c2f2288a69c2e370c62db2d58db9a241023f5c8edce87905d5d5e74d11e9fe3e","manifest_version":"1.60.0","package_version":"0.66.0","peeled_commit":"12d835807580fb118f17942cd6a568e6b37818e3","release_tag":"v0.66.0","tag_object":"3b7ee80d0b6eb5e57934bd5b6cecf837e0a562d6"},"network_contract":{"base_url":"https://data-api.binance.vision","credentials_allowed":false,"kline_attempts_max":3,"kline_attempts_min":1,"time_requests":3},"paths":{"event_root":"/Users/chenm4/Library/Application Support/CryptoQuant/challenger-replacement-v1/state/challenger-replacement-events-v1","python":"/Users/chenm4/Library/Application Support/CryptoQuant/challenger-replacement-v1/deployment/snapshot/bin/python3","runtime_root":"/Users/chenm4/Library/Application Support/CryptoQuant/challenger-replacement-v1","snapshot_root":"/Users/chenm4/Library/Application Support/CryptoQuant/challenger-replacement-v1/deployment/snapshot","stderr":"/Users/chenm4/Library/Application Support/CryptoQuant/challenger-replacement-v1/log/challenger-replacement.stderr.log","stdout":"/Users/chenm4/Library/Application Support/CryptoQuant/challenger-replacement-v1/log/challenger-replacement.stdout.log","target_plist":"/Users/chenm4/Library/LaunchAgents/local.crypto-quant.challenger-replacement-v1.plist"},"plan":{"file_sha256":"5f1774fd912451d79c9efe13401e80f312fee3c707d9faa252933ef3e8810a8f","path":"artifacts/challenger-replacement/challenger-replacement-plan-v0.64.0.json","plan_hash":"c9a1e5f74c52fbf23be5a1d27fd23c25f3601ed58133178fc25480391ab65705","plan_id":"challenger_replacement_plan_65d85d60a534a917f45a1ffa5fc9d3f74d6d24995b900d31b8c73cd26f0bd97b"},"plist_sha256":"e9aeb674bfeed80d6b27d59ac65677a58702a5413eab802854d23c2b32fd2d43","runtime":{"module":"crypto_quant.challenger_replacement_live_runtime_cli","program_arguments":["/Users/chenm4/Library/Application Support/CryptoQuant/challenger-replacement-v1/deployment/snapshot/bin/python3","-m","crypto_quant.challenger_replacement_live_runtime_cli"],"working_directory":"/Users/chenm4/Library/Application Support/CryptoQuant/challenger-replacement-v1/deployment/snapshot"},"schedule":[{"hour":0,"minute":2},{"hour":4,"minute":2},{"hour":8,"minute":2},{"hour":12,"minute":2},{"hour":16,"minute":2},{"hour":20,"minute":2}],"schema_version":"1.0.0","service":{"identity":"gui/501/local.crypto-quant.challenger-replacement-v1","label":"local.crypto-quant.challenger-replacement-v1"},"source_file_allowlist":["src/crypto_quant/challenger_replacement_live_input.py","src/crypto_quant/challenger_replacement_live_runtime_cli.py","src/crypto_quant/challenger_replacement_runtime.py","src/crypto_quant/challenger_replacement_evidence.py","src/crypto_quant/challenger_replacement_decision.py"]}
